Panama,Gatun,Undifferentiated,8.3,11.5,"Collins et al 1996, Coates 1999, Kirby et al 2008",Fossils are rare in the uppermost unit,Kirby et al said mid-late Miocene and placed it from ca 8-12 Ma in log. Collins et al 1996 said the lower Gatun was at least 11.4 Ma and the upper Gatun included fossils from 8.6-9.6 Ma. Hendy 2013 drew the informal subdivisions on a log based on Collins and Coates 1999.,"Base is an unconformity, above Cretaceous volcanics or the Chagres..",Johnson et al (2007) gave a median age of 10 Ma for the Gatun faunule that they sampled from the Panama Canal for NMiTA.
Panama,Gatun,Middle,8.3,9.5,"Collins et al 1996, Coates 1999, Kirby et al 2008",subdivisions are informal units,Kirby et al said mid-late Miocene and placed it from ca 8-12 Ma in log. Collins et al 1996 said the lower Gatun was at least 11.4 Ma and the upper Gatun included fossils from 8.6-9.6 Ma. Hendy 2013 drew the informal subdivisions on a log based on Collins and Coates 1999.,"Base is an unconformity, above Cretaceous volcanics or the Chagres..",
Panama,Tuira,,8.6,11.2,"Coates et al 2004, 2005",,"Coates et al 2005 said 11.2-5.6 for the Tuira, Yaviza, and Chucunaque fms. Coates et al 2004 said the age ranges from 11.2-8.6.",,Johnson et al (2007) give a median age of 10.15 Ma for the Rio Tuira faunule in the Chucunaque basin that they sampled for NMiTA.
Panama,Yaviza,,8.6,9.4,"Coates et al 2004, 2005",,"Coates et al 2005 said 11.2-5.6 for the Tuira, Yaviza, and Chucunaque fms. Coates et al 2004 table 3 gives FAD and LAD age constraints: Yaviza is within 8.6 to 9.4 Ma",,Johnson et al (2007) give a median age of 6.95 for the Yaviza faunule of the Chucunaque basin that they sampled for NMiTA.
Panama,Membrillo,,9.8,11.2,Coates et al 2004,,Coates et al 2004 said constraints are hard to set but bounds are 9.4 (youngest possible) and 11.2 (youngest possible).,,Johnson et al (2007) gave a median age of 11.6 Ma for the Rio Membrillo faunule that they sampled for NMiTA in the Chucunaque basin.
Panama,Tapaliza,,10.5,12.8,"Coates et al 2004, 2005",,Coates et al 2005 said 16.4-11.2 Ma for the Clarita and Tapaliza fms. Coates et al 2004 put dates of 11.2 and 12.8 on the bounds of the Tapaliza in fig 4 but said 1.5 is 'a reasonable minimum age estimate for the uppermost part'.,,
Panama,Gatun,Lower,11.2,11.5,"Collins et al 1996, Coates 1999, Kirby et al 2008",subdivisions are informal units,Kirby et al said mid-late Miocene and placed it from ca 8-12 Ma in log. Collins et al 1996 said the lower Gatun was at least 11.4 Ma and the upper Gatun included fossils from 8.6-9.6 Ma. Hendy 2013 drew the informal subdivisions on a log based on Collins and Coates 1999 at ca 8.8 (lower-middle) and 8.3 (middle-upper). Coates et al 2005 indicated a large hiatus (ca 11.5-9.5) between the lower and middle-upper units.,"Base is an unconformity, above Cretaceous volcanics or the Chagres..",
Panama,Valiente,,12.25,16.5,"Coates et al 2004, 2005",,"Coates et al 2005 said the Valiente and Punta Alegra range from 12-19 Ma, but plot solid deposits from ca 12.25-16.5 for Valiente and 18.25-19.5 for Punta Alegre.",,Johnson et al (2007) give a median age of 6.9 Ma for the S Valiente West faunule in the Bocas del Toro basin that they sampled for NMiTA.
Panama,Clarita,,14.8,16.4,"Coates et al 2004, 2005",,Coates et al 2005 said 16.4-11.2 Ma for the Clarita and Tapaliza fms. Coates et al 2004 put date of 16.4 on the lower bound of the Clarita in fig 4 and said the unconformity on top was at 14.8 Ma.,,
Panama,Cucaracha,,17,18,Kirby et al 2008,Terrestrial,"Kirby et al estimate of 14-19 Ma based on N Am land mammal ages, with 17-18 (Hemingfordian) 'likely'.",,
Panama,Punta Alegre,,18.3,19,"Coates et al 2004, 2005",,"Coates et al 2005 said the Valiente and Punta Alegra range from 12-19 Ma, but plot solid deposits from ca 12.25-16.5 for Valiente and 18.3-21.5 for Punta Alegre, and say Punta Alegra are 18.3-19 Ma. Coates et al 2004 plots a range of 18.25-19.5 for Punta Alegre in correlation chart.",,
Panama,Culebra,,19.1,21,Kirby et al 2008,"Kirby put the Emperador within the Culebra, but it has often been treated as a separate formation as well.","Kirby et al 2008 Sr dates of 19.12-19.83 Ma for Culebra samples, but placed Emperador within the Culebra which means that the early date must be at least 21.",The lower formations in the Panama Canal basin are the Oligocene Caimito and Las Cascadas,
Panama,Emperador Limestone,,21,21.2,Kirby et al 2008,,"Kirby et al 2008 Sr dates of 20.99-21.24 ma. Kirby put the Emperador within the Culebra, but it has often been treated as a separate formation as well.",,
Panama,La Boca,,21,23.1,Kirby et al 2008,,Kirby et al 2008 Sr give dates of 20.62-23.07 Ma in the abstract but 20.99-23.07 in the text. They also moved the La Boca and Emperador to be part of the lower Culebra Fm.,,
Pennsylvania,Trenton Gravel,,0.01,0.13,Geyer and Wilshusen 1982,Geyer and Wilshusen 1982 reinstated the name Trenton Gravel for outcrop of the Cape May fm in PA.,Geolex gives age range of Wisconsinan-Sangamonian. The ICS Quaternary chart puts the range of those N American stages at ca 0.1-0.13.,,
"Pennsylvania, New Jersey",Trenton Gravel,,0.05,0.15,Owens and Minard 1979,"Includes the Spring Lake member in New Jersey, and Van Sciver Lake member.","Salisbury and Knapp (1917) and MacClintock and Johnson (1956) considered the upper bed to be the Cape May Formation and the lower bed, the Pensauken Formation. Owens and Minard disagree, biostratigraphically dating the unit as Sangamonian.",Part of the Cape May fm was renamed Trenton Gravel.,
Petit Martinique,Petit Martinique,,12.8,13.2,Saunders et al 1985; Speed et al 1993,Petit Martinique lies northeast of Carriacou and has unnamed but dated carbonate beds.,"Saunders et al 1985 dated calcareous beds as N11-N12, ca 12.8-13.2 Ma.",Equivalent or slightly younger than the Grand Bay,
Puerto Rico,Quebradillas,,3.6,5.6,Moussa et al 1987,Currently defined Quebradillas lmst is same as what was previously called Camuy fm.,"Moussa et al 1987 reviewed fossil and tectonic evidence and placed the unit entirely as early Pliocene rather than Plio-Miocene; the tilt is the same as underlying units and so must have been deposited before late Pliocene tilting. The authors speculated at deposition from 3.6 to 3.3 Ma. Renken et al 2002 placed the unit as Plio-Miocene, with Pliocene deposited in the NW half of outcrop; no indication of the exact base age.","Overlies the Aymamon, as redefined in Moussa et al 1987",
Puerto Rico,Ponce,,9.84,14.97,"Renken et al 2002, Ortega-Ariza et al 2015",,"Ortega-Ariza et al 2015 dated Sr at 5 locations to generate a range of 9.84-14.97 Ma. Ramirez et al 2006 agree, with Sr ages of 11.56-9.92 Ma for one of the same localities. Ruidiaz-Santiago 2013 also agree, with Sr ages of 13.66 +/- 0.16 and 13.79 +/- 0.19 at the base of Ponce lmst. Maurasse 1990 plate 5a tentatively placed the upper boundary in the middle Lower Pliocene.",Laterally interbeds with the Guanajibo; lower contact is unconformity (Maurasse 1990 plate 5a).,
Puerto Rico,Aymamón,,10.98,13.8,"Moussa et al 1987, Meyerhoff et al 1983, Renken et al 2002, Ortega-Ariza et al 2015",Meyerhoff et al 1983 used the name Moca Lmst for an 'essentially equivalent' unit (Renken et al 2002).,Seiglie and Moussa 1984 said middle or late Miocene based on strat alone. Maurasse 1990 plate 5a in GSA series put it as Mid Miocene and into the upper half of the Late Miocene. Renken et al 2002 said Middle Miocene. Ortega-Ariza et al 2015 give a representative date of 10.98 Ma for Sr estimates. Ward et al 2002 place the lower boundary extreme at the Langhian-Serravalian boundary.,Overlies the Aymamon/Los Puertos limestone (Moussa et al 1987). Meyerhoff et al 1983 suggest an uncomformity.,
Puerto Rico,Aguada,,11.14,14.67,"Renken et al 2002, Ortega-Ariza et al 2015","Called Los Puertos by Hubbart 1920, and technically that name has priority but is not used as much. Maurasse 1990 spelled the names as Aguado and Los Puertas; these may be typos.","Spans the early-middle Miocene boundary, but is mostly mid Miocene (Renken et al 2002). Ward et al 2002 said early-middle Miocene. Seiglie and Moussa 1984 said middle Miocene. Monro 1980 said early Miocene. Ortega-Ariza et al 2015 extend the age to the late Miocene based on 1 core sample and 4 basal contact sample Sr ages.","Conformably overlies Cibao (Monroe 1980), unconformably underlies Amamon as (Meyerhoff 1983)",
Puerto Rico,Los Puertos,,11.14,14.67,"Renken et al 2002, Ortega-Ariza et al 2015","Called Los Puertos by Hubbart 1920, and technically that name has priority but is not used as much. Maurasse 1990 spelled the names as Aguado and Los Puertas; these may be typos.","Spans the early-middle Miocene boundary, but is mostly mid Miocene (Renken et al 2002). Ward et al 2002 said early-middle Miocene. Seiglie and Moussa 1984 said middle Miocene. Monro 1980 said early Miocene. Ortega-Ariza et al 2015 extend the age to the late Miocene based on 1 core sample and 4 basal contact sample Sr ages.","Conformably overlies Cibao (Monroe 1980), unconformably underlies Amamon as (Meyerhoff 1983)",
Puerto Rico,Cibao,Undifferentiated,12.17,27.3,"Moussa et al 1987, Renken et al 2002, Ortega-Ariza et al 2015",No fossils in the Montebello mbr. The fm was named to distinguish the upper part of the Camuy fm,"Ortega-Ariza et al 2015 dated a N PR sample at 12.17 Ma, which is younger than the Seiglie and Moussa (1984) and Ward et al (2002) estimate as late part of the early Miocene. For the Montebello mbr, however, everyone agrees on early Miocene, and Ortega-Ariza et al 2015 even suggest back to the late Oligocene.","Overlies the Lares limestone, underlies the Los Puertos limestone (Moussa et al 1987)",
Puerto Rico,Cibao,Rio Indio,12.17,13.8,Ortega-Ariza et al 2015,Maybe also called or equivalent to the Quebrada Arenas lmst,,Ortega-Ariza et al 2015 dated a Cibao sample at 12.17 and said that unit was Serrevalian (excepting the early Miocene Montebello mbr).,Johnson et al (2007) gave a median age of 8.25 Ma for the Rio Indio faunule that they sampled in the Panama Canal as part of NMiTA.
Puerto Rico,Cibao,Quebrada Arenas,12.17,13.8,Ortega-Ariza et al 2015,Assumed to be equivalent to the Rio Indio based on note for that unit,,Ortega-Ariza et al 2015 dated a Cibao sample at 12.17 and said that unit was Serrevalian (excepting the early Miocene Montebello mbr).,
Puerto Rico,Cibao,Guanajibo,12.17,13.8,Ortega-Ariza et al 2015,Previously had fm status.,,Ortega-Ariza et al 2015 dated a Cibao sample at 12.17 and said that unit was Serrevalian (excepting the early Miocene Montebello mbr).,
Puerto Rico,Guanajibo,,12.17,13.8,Ortega-Ariza et al 2015,Guanajibo is now demoted to a member of Cibao; age assumed to be the same as determined for the mbr.,,Ortega-Ariza et al 2015 dated a Cibao sample at 12.17 and said that unit was Serrevalian (excepting the early Miocene Montebello mbr).,
Rhode Island,New Shoreham,,0.01,0.15,Sirkin 1976,Outcrops on Block Island. Contains the informal Old Town Till and Isaacs Corner Sand members.,"Age is late Wisconsinan (+/-23,000 yrs) according to original description.",Correlates with Roslyn Till on Long Island. Unconformably overlies Montauk drift.,
South Carolina,Ocean Forest Peat,,0,0.1,,,,,
South Carolina,Qu,Undifferentiated,0,0.1,,eolian,,,
South Carolina,Waiter Island,,0,0.1,,,,,
South Carolina,Horry Clay,,0.08,0.13,"Cooke 1937, Frey 1952","Frey 1952 noted that the Horry grades into the Pamlico, and DuBar and Chaplin 1963 abandoned the name Horry Clay to place the unit in the Pamlico.","Cooke 1937 assigned the Horry to the Peorian stage. (Cooke et al 1943 commented that the USGS had by that time stopped using the name Peorian for the glaciation between the Wisconsin and Iowan, lumping the Iowan drift into the Wisconsin.) Frey 1952 did palynology on the Horry and assigned it to the Pleistocene generally.","Underlies or is the lowermost facies of the Pamlico, which ranges back to 0.126 Ma in this compilation.",
South Carolina,Wando,Undifferentiated,0.083,0.129,McCartan et al (1980); McCartan et al (1982); Szabo (1985); Soller and Mills (1991),"Youngest of SC coastal region (Soller and Mills 1991). McCartan et al (1980) indicated the Wando Frm includes deposits formerly within the Pamlico, Princess Anne and Silver Bluff Frms; the authors argued that these names should not be used in S Carolina. The Wando Frm is divided into an upper and lower unit by Wehmiller et al (1988) equivalent to (respectively) the Princess Anne and Pamlico Terraces of Colquhoun.","*Age of unit is unclear: if younger ages for the Socastee and Canepatch Frms are assumed (see discussion below), then the dates indicated for the Wando Frm do not match this compilation. Szabo (1985) found ages of 129,000 +/- 10,000 for the lower Wando Frm and 87,000 +/- 4000 for the upper Wando Frm. The unit has generally been identified as latest Pleistocene in age (McCartan et al 1980), with dates of 126-87 Ka (McCartan et al 1982), isotope stage 5a (~80 Ka) (McCartan et al 1984), 100 Ka based on isotopic data (Soller and Mills 1991), and an older age of 250 Ka (Wehmiller and Belknap 1982), but these authors correlated the Wando Frm with the Socastee and Flanner Beach Frms, so their definition of formations may have differed. All of MIS 5 may be recorded in the Wando Frm (Muhs et al 2003), and there is evidence for multiple amino zones present, but these cannot be directly associated with U-series ages (Corrado et al 1986; Harris 2000; York et al 2001; see Muhs et al 2003); Wando is 70 -130 Ka (Andrus et al 2009).",,
South Carolina,Wando,Upper,0.083,0.091,McCartan et al (1980); McCartan et al (1982); Szabo (1985),"Youngest of SC coastal region (Soller and Mills 1991). McCartan et al (1980) indicated the Wando Frm includes deposits formerly within the Pamlico, Princess Anne and Silver Bluff Frms; the authors argued that these names should not be used in S Carolina. The Wando Frm is divided into an upper and lower unit by Wehmiller et al (1988) equivalent to (respectively) the Princess Anne and Pamlico Terraces of Colquhoun.","*Age of unit is unclear: if younger ages for the Socastee and Canepatch Frms are assumed (see discussion below), then the dates indicated for the Wando Frm do not match this compilation. Szabo (1985) found ages of 129,000 +/- 10,000 for the lower Wando Frm and 87,000 +/- 4000 for the upper Wando Frm. The unit has generally been identified as latest Pleistocene in age (McCartan et al 1980), with dates of 126-87 Ka (McCartan et al 1982), isotope stage 5a (~80 Ka) (McCartan et al 1984), 100 Ka based on isotopic data (Soller and Mills 1991), and an older age of 250 Ka (Wehmiller and Belknap 1982), but these authors correlated the Wando Frm with the Socastee and Flanner Beach Frms, so their definition of formations may have differed. All of MIS 5 may be recorded in the Wando Frm (Muhs et al 2003), and there is evidence for multiple amino zones present, but these cannot be directly associated with U-series ages (Corrado et al 1986; Harris 2000; York et al 2001; see Muhs et al 2003); Wando is 70 -130 Ka (Andrus et al 2009).","The unit may correlate with the Core Creek Sand of Mixon and Pilkey (1976) in northeastern NC (Soller and Mills 1991), but Corrado et al (1986) do not share this interpretation; the unit is also tentatively correlated with the Lynnhaven Member of the Tabb Frm of Johnson and Peebles (1986) (Soller and Mills 1991).",
South Carolina,Wando,Lower,0.091,0.129,McCartan et al (1980); McCartan et al (1982); Szabo (1985); Soller and Mills (1991),"Youngest of SC coastal region (Soller and Mills 1991). McCartan et al (1980) indicated the Wando Frm includes deposits formerly within the Pamlico, Princess Anne and Silver Bluff Frms; the authors argued that these names should not be used in S Carolina. The Wando Frm is divided into an upper and lower unit by Wehmiller et al (1988) equivalent to (respectively) the Princess Anne and Pamlico Terraces of Colquhoun.","*Age of unit is unclear: if younger ages for the Socastee and Canepatch Frms are assumed (see discussion below), then the dates indicated for the Wando Frm do not match this compilation. Szabo (1985) found ages of 129,000 +/- 10,000 for the lower Wando Frm and 87,000 +/- 4000 for the upper Wando Frm. The unit has generally been identified as latest Pleistocene in age (McCartan et al 1980), with dates of 126-87 Ka (McCartan et al 1982), isotope stage 5a (~80 Ka) (McCartan et al 1984), 100 Ka based on isotopic data (Soller and Mills 1991), and an older age of 250 Ka (Wehmiller and Belknap 1982), but these authors correlated the Wando Frm with the Socastee and Flanner Beach Frms, so their definition of formations may have differed. All of MIS 5 may be recorded in the Wando Frm (Muhs et al 2003), and there is evidence for multiple amino zones present, but these cannot be directly associated with U-series ages (Corrado et al 1986; Harris 2000; York et al 2001; see Muhs et al 2003); Wando is 70 -130 Ka (Andrus et al 2009).",Unconformably overlies the Cooper Frm or the Santee Limestone and underlies Holocene eolian deposits (McCartan et al 1980); the unit may correlate with the Core Creek Sand (Mixon and Pilkey 1976) in NE NC and tentatively correlated with the Lynnhaven Member of the Tabb Frm (Johnson and Peebles 1986; Soller and Mills 1991).,"Wehmiller and Belknap (1982) correlated the Wando Frm with the Socastee and Flanner Beach Frms, which supposedly underlie the Wando Frm in this report; the definitions of these formations may have changed or may differ from those of the authors, leading to this discrepancy."
South Carolina,Flanner Beach  ,Undifferentiated,0.1,0.2,Wehmiller et al (1988); Wehmiller et al (1995),"Strata of this age are referred to by various names in the region; the Neuse Frm of Fallaw and Wheeler (1969) replaced the Flanner Beach Frm for just the fossiliferous Pleistocene deposits in NC. However, Mixon and Pilkey (1976) indicated Fallaw and Wheeler (1969)'s unit contained many different lithologies and was not used by these authors, with the type section re-defined as the Flanner Beach Frm. Blackwelder (1981b) also included sediments assigned to the Neuse Frm in the Flanner Beach Frm and abandoned the Neuse Frm. Dockal (1996) indicated the name Neuse Frm, which includes the Cape Fear Coquina, has priority over the Socastee Frm and should be in use. The Neuse Frm is still used in publications for sediments in NC, while others refer to these sediments as the Flanner Beach Frm or even the Socastee Frm. ","*Age unclear in spite of years of study (see Muhs et al 2003). Wehmiller et al (1988) using amino acid racemization found an age for Snow Cut material of ~220 Ka or even older, with a further study (Wehmiller et al 1995) indicating an age of ~330-130 Ka. Prosser (1993) performed U-series dating on shell hash at Snows Cut and obtained an age of 62 Ka. Dockal (1996) did radiocarbon evaluation of Snows Cut material and found an age of 29-24 Ka (Dockal 1992, 1995), but these dates are probably too young according to the author, with an actual age closer to 75-55 Ka. Hollin and Hearty (1990) analyzed the Socastee Frm in SC and indicated an age younger than typically assigned, around 80 Ka. Muhs et al (2003) indicate the dates of Hollin and Hearty (1990) would be consistent with aminostratigraphic comparison with the Sea Islands VLPG data.","Correlative with the Great Bridge Frm of SE VA [now Acredale Frm] and with the Socastee Frm of SE NC and NE SC (Miller 1985) [the Acredale Frm, however, appears younger than the Socastee and Flanner Beach Frms, although the age is debated].",
South Carolina,Ten Mile Hill beds,,0.2,0.25,McCartan et al (1990); Weems et al (1994); Andrus et al (2009),Deposited in a marsh environment near Charleston (Weems et al 1994); equivalent to unit Q3 of McCartan et al (1984) (McCartan et al 1990; Weems et al 1994).,,The unit may correlate with the Socastee Frm (Szabo 1985; McCartan et al 1990; Weems et al 1994).,
South Carolina,Ladson,,0.4,0.45,McCartan et al (1990),"Named by Malde (1959) in the Charleston area; may be equivalent to the Canepatch Frm of the Myrtle Beach area of DuBar (1971), but the ""Ladson"" name is older and thus retained (Weems et al 1994). The unit is interpreted as a fluvial/deltaic deposit (Wehmiller et al 1988). Like the Canepatch Frm, the unit is also referred to as unit Q4 (Weems et al 1994; Bowen 2009).",,Equivalent to the upper Talbot terrace of Colquhoun (1974) (Wehmiller et al 1988); considered a Charleston-area equivalent of the Canepatch Frm of Myrtle Beach (Corrado et al 1986; Weems et al 1994; Bowen 2009). ,
South Carolina,Pringletown beds,,2.1,3.1,Weems et al (1994) indicated a late Pliocene and early Pleistocene age; the age cited here was determined via stratigraphic position and based on ages of other units.,Informal unit named by Weems et al (1994) for sediments near Charleston; considered an estuarine to lagoon deposit.,,The unit may underlie the Waccamaw? Frm and overlie the Raysor Frm (Weems et al 1994).,
South Carolina,Wabasso Beds,Undifferentiated,4.3,5.5,Huddlestun (1988); Markewich et al (1992); Campbell and Campbell (1995),"The Wabasso Beds is an informal name applied to lower Pliocene, phosphatic, calcareous, and microfossiliferous, variably argillaceous, silty, fine-grained to very fine grained sand in the subsurface of the coastal area of GA, southern SC, and eastern FL (Huddlestun 1988); Scott (2001) indicated the Wabasso Beds are also in the Peace River Frm in S Florida, but that they do not outcrop at the surface. The Wabasso Beds were treated as formational rank by Krantz (1991), but there seems to be no evidence for this, although Huddlestun (pers comm 2013) would like to see them formalized.",The unit is included within zone PL1 or N-18 (Huddlestun 1988); the unit is considered no older than 5.7 Ma and no younger than 4.2-4.0 Ma (Markewich et al 1992).,The unit is probably time equivalent to the Sunken Meadow Member of the Yorktown Frm in SE VA and NE NC.,"Krantz (1991) indicated the lower Duplin Frm is time equivalent to the Sunken Meadow Member of the Yorktown Frm and Wabasso Beds, but this relationship was not supported in this compilation; here, the Duplin Frm is younger than the Wabasso Beds and the Sunken Meadow Member. "
"South Carolina, Georgia",Parachucla,Undifferentiated,20.2,23.3,"Hunter and Huddlestun 1981, Huddlestun 1982, 1988","Lower member is early N4 (Huddlestun 1973), upper is late N4-early N5","Fig 2 in Hunter and Huddlestun 1980 is biostratigraphic correlation chart between land mammals, bolluscs, and formations, in a log for FL, GA, MD, and NJ. Scott 1988 fig 19 plots SC and GA log sections as equivalent for Coosawhatchee, Marks Head, and Parachucla fms. Mueller et al 1993 dated Parachucla fm in Hamilton County back to 24.4 Ma (with one sample at 19.4) with Sr; a sample from type locality in GA gave 20.2 Ma.",,
"South Carolina, Georgia",Parachucla,Porters Landing,20.2,22,"Hunter and Huddlestun 1982, Huddlestun 1988",called 'upper' prior to Huddlestun 1988,"Fig 2 in Hunter and Huddlestun 1980 is biostratigraphic correlation chart between land mammals, bolluscs, and formations, in a log for FL, GA, MD, and NJ. Scott 1988 fig 19 plots SC and GA log sections as equivalent for Coosawhatchee, Marks Head, and Parachucla fms. Scott 1988 updates the correlation of biozones with chronology, so those dates are used to define ages here. Huddlestun 1988 thought it was N5, and possibly into late N4.",,
"South Carolina, Georgia",Parachucla,Tiger Leap,22,23.3,"Hunter and Huddlestun 1982, Huddlestun 1988",called 'lower' prior to Huddlestun 1988,"Fig 2 in Hunter and Huddlestun 1980 is biostratigraphic correlation chart between land mammals, bolluscs, and formations, in a log for FL, GA, MD, and NJ. Scott 1988 fig 19 plots for log of Coosawhatchee, Marks Head, and Parachucla fms as equivalent between SC and GA. Huddlestun 1988 put the age as N4, 22-23.3 ma.",,
"South Carolina, Georgia, Florida",Coosawhatchee,Undifferentiated,13.3,15,"Scott 1988, Huddlestun 1988",Hawthorn group,"Scott 1988 fig 19 plots log sections for Coosawhatchee, Marks Head, and Parachucla fms as equivalent between SC and GA. Blow zone N10-N11, Early Serravallian, 13.3-15 with an undifferentiated coquina possibly extending past 16 Ma (Huddlestun 1988). Overlies the Marks Head, so oldest possible age is the upper age for that unit. Abbott 1980 put rock dated at 14-15 Ma in N11, and zone N12 as ending by 13.3 Ma which would make that a younger bound. Gibson 1980 plotted N11 as spanning 14.5-15 Ma only.","Coosawhatchie fm correlates with lower portion of Intracoastal Limestone (Schmidt 1984), lower Shoal River fm (FL), and lower part of the Peace River fm (FL) (Scott 1988). ",
"South Carolina, Georgia, Florida",Marks Head,,17.6,18.9,Hunter and Huddlestun 1980; Scott 1998,Hawthorn group,"Blow zone N6 or early N7 (Burdigalian - back to 19 Ma by Scott 1988 but maybe should be 20.4-20.5); Marks Head (GA) correlates with Torreya (FL) and both are older than the Chipola (FL); Marks Head correlates with upper Arcadia but is younger than the Tampa member of that fm in FL, and may correlate with the lower Pungo River in NC (Scott 1988). Huddlestun 1988 agreed that it correlates with Torreya and spans N6 (ca 17.6-18.9 Ma on log); didn't suggest any rock into N7. Hunter and Huddlestun 1980 had put a late age of 16.75 in the log.","Correlate with most of Torreya; zone N6 and into very early N7 (Hunter and Huddlestun 1980). Scott 1988 defined the Marks Head fm to include the middle unit of Hawthorn group (FL). Fig 2 in Hunter and Huddlestun 1980 is biostratigraphic correlation chart between land mammals, bolluscs, and formations, in a log for FL, GA, MD, and NJ. Scott 1988 fig 19 plots log sections for Coosawhatchee, Marks Head, and Parachucla fms as equivalent between SC and GA.",
